overall,reviews
4,"Rebeka was amazing to work with and both items were beautiful!  I couldn’t be happier and highly recommend her if you are looking for unique, well made gorgeous jewelry.  Thanks Rebeka!"
4,I purchased three pairs of earrings from Rebekajewelry and wow it is absolutely stunning and very classy. I can't wait to wear them. The jewelry designer is very gifted and creative. I definitely recommend this company. I will order more items from them. Keep up the good work. All the best 😘
4,"Recieved this beautiful emerald necklace yesterday. All i can say is it is stunning. Certainly unique. I look forward to wearing this for my wedding ceremony. 
Will certainly recommend and purchase again. 

Not only is the product beautiful but Rebeka also is very plesant to deal with. 

Thank you!"
4,En attente de commande! C’est un scandale
4,Wow! Amazing beautiful Best Buy I’ve done so far! Speechless on how awesome this necklace looks!
4,I purchased three pairs of earrings from Rebekajewelry and wow it is absolutely stunning and very classy. I can't wait to wear them. The jewelry designer is gifted . I definitely recommend this company. I will order more items from them. Keep up the good work. All the best 😘
4,"The earrings are gorgeous. I wish I would’ve checked the measurements before I purchased them, though. They’re smaller than I expected."
4,Absolutely gorgeous ring. Exactly what we were looking for!
4,Love these rings. Fit perfectly and look exactly as they did in the picture
4,Absolutely beautiful ring. Looks exactly as shown in the image. I love Australian opal and this ring is perfect.
4,I purchased three pairs of earrings from Rebekajewelry and wow it is absolutely stunning and very classy. I can't wait to wear them. The jewelry designer is very gifted. I definitely recommend this company. I will order more items from them. Keep up the good work. All the best 😘
4,I needed a bracelet to complement earrings for a wedding. Rebeka did a fantastic job in creating a beautiful bracelet! Professional and timely and great communication throughout the process!
4,Beautiful
4,I was looking near and far for this specific item and low and behold here it was. Communication was easy and I received my item across the world in less than two weeks. Couldn’t be happier.
4,"Rebeka has amazing customer service, she made sure the earrings got to me in time for my wedding. The earrings are beautiful, well made and very high quality! Couldn't have been happier, thank you!"
4,It's absolutely beautiful! And arrived surprisingly quickly considering it ships from Israel. Repeat customer here.
4,"Wow 😯😁💍...I absolutely love this ring, it was worth it,its an evil eye ring,but it is not evil,it protects you etc.. but I have bought a few and this by far my favorite one thanks 😊  again!! Also she is there anytime, great communication 👏 and it got here super fast!! Love it! I will be returning 🤗 for sure,she carries alot of gems and stones etc.. thanks again Beka!!"
4,"Pretty ring, was way too big but I bought a ring guard for $10 and it fits great now. Shipping took forever but that’s expected because of covid"
4,"Absolutely stunning! Just as the photo shows. The item was shipped immediately after I placed my order however, the shipping did take longer due to COVID (I did not choose expedited shipping.) Rebeka was very responsive to all of my messages and very easy to work with. Highly recommend!"
4,"The earrings arrived today, on schedule for my sister's birthday.  She LOVES them.  She said they are a rich color and very pretty.  Thanks for your help getting the order there quickly.  I'll look for your products again--for me!
Lynn Scheuerle"
4,These are beautiful and just as pictured
4,"Gorgeous! Can't wait to wear them on my big day! They do dangle a bit more than I expected, however, that may just be the size of my ear lobes so take that with a grain of salt. They're beautiful!"
4,Absolutely  gorgeous. I just love them!
4,"The red coral earrings are lovely.  The colors within the stones are gorgeous and well illustrated by the photos provided on Etsy by Rebeka.  The earrings measure roughly 1"" x 3/4"" (25mm x 19mm) -- the size is again well illustrated by the photo provided by Rebeka.  The earrings arrived in a timely manner -- I certainly recommend doing business with Rebeka."
4,"this is so huge - i am impressed, love it ."
4,Take quite sometime to receive but it’s all worth it. It’s beautiful. Even though the pendant is so big it’s lightweight. Thanks
4,so beautiful! i love the chain design! the pendant is perfect!
4,Beautiful emerald crystal cufflinks! The gold customization was quick and easy -- packaged well and shipped quickly! Thank you!
4,All of Rebekas jewelry is beautiful! Shipped really quick! Love love love
4,Wife loved them. Great product
4,Beautiful ring for my Fiancé that fits him like a glove. Great communication and clarity from the shop as well. Highly recommend!!!
4,The necklace is perfect and just like it looked in the picture. Highly recommend!
4,"Absolutely IN LOVE with my earrings! I can not wait to wear them on my wedding day.
The style is exactly what I was after, and needing clip-ons, it was wonderful to find someone who could cater to this!"
4,"These earrings are absolutely beautiful.. better than the photograph ... but even more important is that when dealing with Rebeka she is amazing , so helpful and she answers anyvqueries straight away . 5 stars for her in every direction . Thank you .. Rebeka ... I will order more from you Gloria"
4,"I love them. They look exclusive, are the right color. Thank you. Just what i was looking for."
4,"This item is lovely.  The shop stated the piece was shipped out during the week, only when I inquired as to why the tracking wasn’t updating, I found out it was not shipped and was shipped almost a week later."
4,"So beautiful, they look perfect"
4,Beautiful little earrings! I gifted these to my Mom for Christmas and she loves them! The backings that came with them were too large and wouldn't stay snug but besides that they are perfect.
4,"Just received my earrings.
I'm so excited. It's even nicer than the picture on display. I highly recommend her and will certainly buy from her again.

Thank you so much!"
4,They are amazing ! Very good quality and very chic !
4,"Ich habe diese Ohrringe bis heute ( 1 Monat nach der Bestellung) noch nicht erhalten und kann sie deshalb nur nach der Wartezeit beurteilen, die ich zu lang finde."
4,The necklace was exactly as described! Shipping was fast as agreed upon when contacting the seller beforehand.
4,"My ring is beautiful very well made, took a bit longer to arrive because of the pandemic, which is to be expected! I highly recommend Rebeka's craftmanship , she is a very skilled jeweler! ;) Now I have a little piece of Israel on my finger!! Love it!! God bless everyone!! Stay safe world!!"
4,I LOVE my new bridal jewelry!
4,"Tiara shipped in a reasonable time, it is not needed till next year for wedding.  My daughter thought it was stunning and will compliment her dress."
4,So unique and beautiful! I love them!!!
4,"Love, love, love, love, love!"
4,"ho pagato esattamente  23,70 euro di spese doganali,  questa collana mi è costata un botto!!
Bisogna specificare cosa vogliono dire gli oneri in più però!!"
4,These are simply gorgeous & stunning!
4,"I LOVE THEM,  they are very pretty! !!!"
4,Stunning! I Love and recommend this company.
4,"I love these earrings.  I have been wearing them everyday since I received them, even in this time of Covid.  I wear them in the evening when my husband and I are playing Scrabble and having happy hour outside. They're bright and noticeable without being gawdy.  They look just like the photo."
4,"Absolutely stunning. I purchased several items from Rebekajewelry, she is the best."
4,love the color! honestly gorgeous
4,dazzling very well made and professionally set. Wife loves it. Statement Ring.
4,Beautiful earrings. You can tell they use quality crystals to make them because they shine beautifully. I cant wait to wear these for my wedding in February.
4,"Shipping took a little longer than expected, and given the price, the quality is a little lower than I anticipated - it’s very lightweight. However they are otherwise exactly as pictured and will look very pretty on my wedding day and in photos. Customer service was very quick and Rebeka was very kind and friendly, as well."
4,Found these earrings for my mother she loved them. Exactly her style and looked exactly as advertised. Beautiful quality!
4,"The necklace itself is beautiful. The corrected matching earrings I received as a gift for my wedding are beautiful as well. 
UPDATED REVIEW: The customer service is something less than desirable, it was not until after my initial review that she offered to pay for the return shipping for a manufacturing error that was originally on her end. However, Rebeka did pay back the return shipping & gave me a discount code for a future purchase."
4,"I received my ear-rings and they were beautiful.  I am really happy with them, they are a true colour and a perfect size.  I can’t wait to wear them to my sons wedding."
4,BEAUTIFUL!! The very best earrings I have EVER purchased on Etsy. Truly stunning. Fast shipping and great communication. Very elegant.
4,The earrings I bought from this shop are so beautiful and I can’t wait to wear them on my wedding day!
4,This is an exquisite piece of jewelry. You can tell there was a lot of love when it was made. Very satisfied
4,"Beautiful necklace, seller observed length request."
4,This necklace is perfect. The beautiful eilat stone surrounded by silver is large enough for a tall man (or women) to wear and others' will see it. The chain is a comfortable length and sparkles. It also has an easy to open clasp. A terrific purchase.
4,These earrings are nice...the montana blue color is beautiful.
4,"These earrings are exactly as pictured. Great quality, but still light so they will not feel uncomfortable if worn for long periods of time. I love the closed hook as well. Can’t wait to wear them at my wedding!"
4,"Beautiful item- Seller resolved issue with missed notes on sizing after contact. 
Pendant was slightly smaller than listed but beautiful all the same.
Beware customs charges if ordering from the UK!"
4,"Ordered this for my wedding day necklace and I am super disappointed. One of my colors is blush and I was very excited for the blush center stone, however the stone looks like a brown colored gemstone."
4,The ear cuff is beautiful! It's exactly as described and arrived on-time.
4,"Beautiful, dramatic and the colors in the stones are stunning."
4,Vraiment très beau je l'aime beaucoup
4,These are stunning. So excited to wear them on my wedding day.
4,It’s so beautiful n perfect as shown in the picture
4,This ring is beautiful. Excellent quality. The seller shipped it in a timely manner and tracking was provided. I would definitely purchase from seller again.
4,It’s perfect. Very cute!
4,Great quality beautiful ring I am very happy with my purchase.
4,WOW!!! I LOVE these earrings. They go perfect with my wedding dress.
4,"I really was excited about this piece, as I had order several pieces prior.  The wrong piece was shipped even though the instructions were followed to add a message for specifics.  It took days for the shop to answer questions to correct the error.  Then, the item was received after I needed it.
I do like the pieces; hopefully, communication will get better."
4,Beautiful necklace that is unique!
4,Item has still not arrived. Have waited a month now. On top of that had to pay extra £24 for customs charge which was not displayed in advert.
4,"Bonjour, 
Superbe création, colis arrivé ce mercredi en excellent état dans un écrin magnifique.
Merci à très vite"
4,"The shipping took longer than expected, but they finally arrived. Beautiful earrings. I can't wait to wear them for my wedding day!"
4,"Such a beautiful piece, super fast shipping, great customer service.  DON'T hesitate to purchase!"
4,Nice product. As we expected!
4,Love the earrings great quality. Thanks
4,Me han gustado mucho los pendientes verdes. Son muy bonitos y me gusta el contraste en los dos tonos de verde.
4,Didn't look like pictures. It's more in your fsve gold. S it needed woul be glitter...😂
4,Magnifiques boucles d'oreilles ! Joli cristal
4,"Beautiful jewellery, amazing colour. Speedy delivery"
4,Exactly as pictured. It’s beautiful; delicate and understated. It will be a perfect gift for my maid of honor!
4,"it’s beautiful, my wife loved it!"
4,The bracelet is exactly as described. It arrived on-time and goes beautifully with my other pieces.
4,Looks just same on the picture.
4,Communication and earrings are great. Delivery was quite slow :)
4,Beautiful would definitely buy again!
4,Absolutely beautiful!  I bought them for my sister who is getting married and she couldn't be happier!
4,En attente de la commande. C’est un scandale
4,"I have never received the ring, even after waiting three months. When I asked the seller, she only sent me a transport reference, inviting me to contact the services of transport, which was totally useless. She wasn’t helpful at all and I am very disappointed because I will never receive the ring and lost my money. 
I will never order again to this seller and recommend everyone to avoid this shop"
4,"Looks great, just like the picture.  Considering it had to come from overseas, it was shipped very promptly.  The only remaining question is how durable it is, but that will take time to see..."
4,"Lovely product, great communication.  Will buy from Rebekah again."
4,Me quedan muy bonitos.
4,Excellent customer service!
4,Beautiful jewelry and great service from Rebeka. Very responsive and very gracious. Package arrived very quickly! Thank you!
4,"Stunning earrings, I can't wait to wear them for my wedding....
Thank-you for creating such a beautiful piece of jewellery that I can cherish for a long time...."
4,"Beautiful earrings, lovely colour and great quality!"
4,"Exquisite earrings. I’ve purchased several items from this seller and I 
I’m thrilled with all of them. Enthusiastically recommend!"
4,"Great quality and fast shipping, thank you."
4,These earrings are beautiful. I will definitely purchase again from this shop!
4,"The item was okay, however, the picture is very misleading. The description matches the earings(the size of the stone), but the picture gives a different image of the item. For instance, in the sellers' image, the stone looks round, full, with vivid colors. In reality, this is not exactly the case. For one, the stones don't look the same. One stone is rounded and the other is not.  When I opened the box I was disappointed. Still, the earrings look good, but they didn't live up to my expectations.  The package was shipped on time. Everything else is okay, I guess."
4,Stunning jewelry and great service!
4,"It finally arrived and is very beautiful, however it is not the size ordered. It is three sizes too small. Disappointing."
4,Beautiful!!! Worth the wait for it to come from Israel!
4,Been a month and a half and still haven't received my earrings. When my wedding was 2 weeks ago....so needless to say I'll be requesting a refund
4,These earrings are beautiful. I can’t wait to wear them.
4,Most beautiful will be proud to wear my charm.
4,Arrived very timely.  A Christmas present for my granddaughter and I know she will be delighted and love the cameo!  Thank you!
4,Bought this for my friend and it is absolutely gorgeous and just as described!
4,I love these earrings! They will go perfectly with my wedding dress!
4,Great service and nice product.
4,Beautiful earring. It was a gift for my wife
4,Beautiful ring and smooth transaction
4,"Beautiful earrings and bracelet, as described. 
Will certainly purchase again and recommend to my friends."
4,"Beautiful item - smaller than advertised.
Beware customs fee ordering from the UK"
4,"This would be a 5 star review except the setting around the stone was more uneven/rough than expected. It was a gift, and the recipient said they loved the ring and would wear often!"
4,Fast delivery and as expected
4,"Pretty shade of red, make a statement"
4,super belle ceinture vraiment magnifique
4,Arrived safely in my mailbox.  It's more beautiful than I expected.  I love it.
4,"Lovely necklace, great detail. Would recommend this seller! Many Thanks"
4,"It's a little smaller than the image shows, so disappointed, it must be on a woman's hand to make it look larger? I had a similar men's ring that was twice the size for half the price. I'll wear it..."
4,Great looking pendant! Thank you
4,Beautiful cufflinks and arrived in plenty of time. Thank you
4,"Thank you, my beautiful earrings arrived  and I love them. I need to go look in your shop again xx Wonderful packaging and arrived very quickly. Thank you x"
4,Beautiful earrings. Make me feel like a star and great colours!
4,"Item arrived late but fortunately arrived safely and in perfect conditions! They're exactly as shown in the pictures, really lovely and original product (especially because it's customizable)"
4,Ace jewellery and UK made. Thanks!
4,"I love the colour of these earrings,  they are so unusual and I've had compliments on them already.  Many thanks"
4,"Fast shipping, fun & friendly creators, lovely earrings"
4,Bought as a gift and really happy with them. Thank you x
4,lovely bright colours thank you
4,good but a bit uncomfortably tight on the ears
4,"It was packaged nice and was delivered to me in a timely manner. The 925 Silver is shiny and very beautiful. However, I do think that these specific ones don't compliment my ear shape very well. They also would slide off my ear occasionally throughout my day when I would wear them. *5 stars for the fast shipping, reasonable prices, and secure packaging. Definitely looking forward to trying out some other styles of earrings and ear climbers from this shop in the future."
4,Looove them!!
4,Love these ear climbers they are my first pair definitely will be purchasing more! Great company got my item quickly and exactly what I wanted!
4,"I don't wear earrings a lot.  Due to my job requiring me to be on the phone almost 80% of my day, they are uncomfortable.  But these, are exactly what I needed!  I've gotten a lot of compliments on them!"
4,Absolutely love these!
4,LOVE!!
4,These are beautiful earring climbers!!! I wanted a simple silver look and these are PERFECT
4,Fast shipping & the quality is excellent!! I was able to adjust the ear climber easily & it feels very secure. Love the way they look—just like the photo.
4,Love it! It's perfect!
4,"Wow, these ear climbers are so beautiful in person! They're elegant and better than I expected. They're also incredibly light so you don't notice you're wearing them. You can sleep in them, shower in them, etc., and they stay securely in place. Also, the shipping was super fast. Thank you!"
4,"Bought about three months ago and I still love them! The shop owner was so nice! I wanted to exchange the matte gold for the shiny gold, and she was beyond accommodating! 10/10 would recommend."
4,"Came in very fast!!! Love these earrings, very minimalistic!!!"
4,Its fits my ear perfectly!
4,The Black Rhodium pair is edgy and perfect for work outdoors. Thank you so much. Exactly what I've been waiting for. (I squeezed them tighter for the perfect fit.)
4,I loved the earrings they were exactly what I was looking for and curved great with my which I loved so thank you very much!
4,"Beautiful ear climbers. I love have dainty they are, but sturdy enough. Great price and fast shipping."
4,"Love, love, love these earrings. Buying more will definitely be in my future. They'd make great gifts."
4,Very happy with my purchase and they fit perfect.
4,These are a cute style but my ears got irritated and itchy from the matte gold.
4,Shipped very fast! Earrings are more of a gold color rather than rose gold but I still like them.
4,Just received my ear climbers today. They're dainty and beautiful. I have small ear lobes so these are the perfect fit! Thank you!
4,"I love how unusual they look! Very comfortable, however sometimes a little difficult to get into my ear."
4,"Shipping was fast, earring looks great, would buy again."
4,Loved
4,Very cute and seem to stay in place really well. I love them!
4,Minimal and light look for hot summer days. Great for work. Adjustable to your ear. Many compliments.
4,Absolutely love these earrings! Arrived super quick and are even more stunning in person. They are also very comfortable to wear :) thank you so much
4,Beautiful earrings! I'm so happy :)
4,"love these, goes well with every occasion."
4,"I love these earrings, so complimenting."
4,My new favorites! Wear them all the time and get lots of compliments - thank you for the prompt shipping too!
4,"Love these ear climbers! Lightweight, delicate, and dainty, but it doesn't feel like they'll break easily. You won't regret this purchase, especially at this price."
4,Excellent quality. I love these ear climbers!
4,it arrived very fast and I like the beautiful simplicity of this earclimbers and the price was right -Thank you !
4,Beautiful earrings. Get tons of compliments. Fast shipping
4,"Just Right! Perfect size, easy to put on, stays secure. A new favorite- Thank You!"
4,Love! Thanks!
4,Product is nice but doesn't look like a matte rose gold looks like gold. Other than that it is a nice product
4,These earrings are super pretty. I can't wait to wear them for my sisters wedding. They were shipped so quickly and the owner was able to ship both pairs I bought together.
4,Love these pretty little earrings!
4,Love these! They look as shown and easily fit ear. The only negative is they get caught on clothing and slide out.
4,Love these ear climbers! Comfortable enough to sleep in as well.
4,"I got a notification that a shipping label had been created 20 minutes after I had placed the order.

These earrings feel sturdy and well-made while at the same time being delicate and minimalist. I've never worn ear-crawlers before so it took me a day or two to figure out what was comfortable. I was able to bend the back slightly to fit to my ear, and now it's been in place for a couple of weeks. I am very happy with this and it's exactly what I've been looking for."
4,Love these - thank you!
4,Super fast shipping and love the earrings even more than I thought I would!
4,"Original, comodo, perfecto. Llego muy bien de tiempo. Todos genial."
4,They are very pretty & shiny and small.
4,"Love these, very cute. I wear them daily."
4,"My ears are super sensitive, but these are amazing. I’ve been wearing them all day and no sensitivity at all."
4,A little smaller then pictured but very cute and simple!
4,"Very quick shipping, looks like picture, sterling silver so I’m sure it will hold up (I just rcvd it)... I’m happy."
4,Awesome earrings! Shipped fast and people compliment them all the time
4,"So cool love them, thank you!!"
4,Shipped quick and is exactly how it is described and looks in the picture!!
4,Love it !! Came fast and was exactly what I expected
4,"Very pretty! They are a little itchy on my sensitive ears, but otherwise perfect."
4,Great communication and product. Highly recommend this shop.
4,"Wonderful!  A little sharp on the edges (don't sleep in them!), but I get plenty of complements!"
4,Wonderful customer service and helped correct a mistake on my behalf.  Beautiful earrings.
4,Nice earrings for the price. Wore them one day so far and already had compliments. Great transaction
4,My new every day earnings. 💜💜💜💜
4,Love every earring I've gotten so far! Thank you.
4,Love these! Wear them EVERYDAY!
4,"Great seller! Seamless transaction, beautiful earrings. :) Thank you!!"
4,This is my 2nd order from here and I love the products!
4,Fast shipping! Item exactly as pictured. Love it!
4,It arrived in good time
4,These are so adorable.  Just as pictured & fast shipping.
4,Great communication & fast shipping!!  A+
4,Very pretty and unique.
4,Arrived fast and cute little earrings! I love them!
4,"Really pretty! Looks exactly like the pictures! And fast shipping, too!"
4,Great earrings. Just like the picture.
4,"Beautiful, wear them all the time."
4,Shipped quickly - as described. Love it!
4,Very cute earrings! Great quality!
4,"looks great, but did begin to tarnish"
4,"perfect size, easy to put in & remove"
4,Beautiful and simple classy earrings. well made
4,"These are edgy in a non-blingy way, cool and pretty!"
4,Fast shipping! Great product
4,Beautiful & exactly as described - thank you!
4,These earrings are beautiful and fit well.
4,"Shipped quickly and look great, will definitely be back for more!"
4,"These are great! Very cute, received quickly"
4,Seller is very responsive and sweet. Cute earrings! Thank you.
4,"Great for daily wear, even to office."
4,Nice thank you
4,"This is my second time buying these earrings, because my friend begged to have my first pair. They’re gorgeous and unique!"
3,"Awesome earrings, thanks so much!"
3,"Beautiful earring, like on the photos and the description"
3,Very cute and dainty and don’t hurt my ears.
3,The earrings are great. Thanks!
3,Love these earrings! Bought a pair for myself then my sister.
3,The earrings came quickly and are beautiful!
3,"I think these ear climbers are beautiful, however they won’t stay in place. They are always hanging down, not laying flat on my ear lobe."
3,Smaller than I expected and very thin metal.
3,Exactly as described and good service.
