overall,reviews
2,"Was worth the wait!  Very cute, well made, and came in a pretty box with a bow and a handwritten note.  Also got a free gift!  Thank you so much!"
2,Exactly as advertised. Extremely beautiful and delicate (which is what I wanted). I love it! It came quickly and without issues. Will order from this store again!
2,Style look  unique design light weight
2,I am one happy customer! Firstly there was great communication from the seller. I love the earrings! They look exactly like the picture and are so chic and unique. Also I love the little freebie ring with my initial! Thank you so much!
2,"These earrings are so cool and I'm getting a ton of compliments while wearing them. I love them! Thank you for the extra included in my package, it's great! Buy with confidence~"
2,"Beautiful, well crafted and sturdy! My new favorite earrings!!!"
2,I love my it!!!! Fast delivery and such a nice card and gift from Gracie
2,"Love!! Etsy insists I use more words in my review, but just ""Love!"" is all you need to know!"
2,"Very nice, simple earrings.  Seller was sweet to interact with.  She thought of everything - the items were boxed up in a nice gift wrap, with cushion to avoid damage.  When I opened it I was thinking, ""it would be nice if these were a bit shinier,""...then I looked, and she included a polishing cloth!

Shipping took time."
2,thank you - I love them!!!
2,Beautiful
2,"The X earrings are Beautiful. I have not worn yet, but looking forward to wearing them on date night. Thank You."
2,"Loved my earrings! Gracy made sure my earrings arrived promptly, and I even received a sweet, hand-written note and a free customized ring with my order. The jewelry is beautiful and well-made--super happy with ordering from this shop."
2,I LOVE them! So cute and simple! Thank you!
2,I love how they look in person! Gracy was also very kind enough to add in a free pair. They are both gorgeous.
2,SO ADORABLE! Have worn nonstop!
2,Stunning earrings! Really pleased thank you! Unique and beautiful x
2,Arrived safely in cute packaging!
2,So cute! I just love them!
2,Thank you! The earrings are lovely and also thank you for the extra little ring! Packaging is beautiful as well :)
2,"second time buying this product. not because i was dissatisfied with it the first time, but because I loved it so much I wanted it in a different color"
2,Thank you so much for a lovely pair of ear rings! I wear them just about every day! The shipping was very quick and I really appreciate the care you put into crafting them. I will definitely be buying a few of your other items as gifts for others :)
2,"These are stunning and I love them. Also, I got a really lovely package with a personal message and a little gift in it. Shipped in no time without problems."
2,Beautiful earrings and great customer service. Shipped quickly and arrived quickly considering the international distance. Seller is very considerate and leaves a handwritten note.
2,"Really awesome earrings, I love the design!"
2,"These are adorable, but they don't stay in for more than 5 seconds. They need a backing to hold them in place. I lost one before I even left my house -- still looking for it in the rug."
2,"Absolutely love this seller, the earrings were shipped with an awesome message...enjoy your journey!  I'm gonna do that & enjoy my beautiful earrings!"
2,The perfect Christmas gift and the shop owner was such a sweetheart!!! Thank you!!!
2,Love them! Thank you !
2,Amazing product!
2,Totally loved them! And appreciated the free little gift that came with it! Thank you!
2,I really like the personal touches :)
2,"Love the earrings! The package arrived wrapped beautifully, it was so nice to open! Thank you. Can't wait to wear."
2,Exactly what I had hoped for! Beautiful and unique.
2,"I love them, thank you!"
2,Very unique and pretty earrings with thoughtful note and a surprise complimentary ring!  Thank you so much.  Will enjoy these for a long time.
2,"Love them, thanks a bunch!"
2,Really cute and Nice! Like it! Bit fragile Stuff.
2,loved them thank you .
2,Thinner than I thought. Really is just a wire wrapped into a shape. Was expecting them to be a bit stronger. Positive: they are extremely light!!
2,They arrived so beautifully packaged with care. I love them - thank you!
2,Great stylish earrings
2,"This item arrived quickly, despite international shipping. They are unique and pretty."
2,Lovely earrings! Great packaging and sweet little surprise. Thank you!!
2,Love them! Have been wearing them daily :)
2,beautifully crafted! can't wait to wear them!
2,Really cute and simple earrings.Quite unique
2,"Cute dainty earrings that seem to be good quality. The shop owner, Gracy, was very thorough during the shipping process."
2,Fantastica earrings!  I wear them all the time!
2,"Wonderful seller, very responsive, really like earrings :)"
2,Boucles d’oreilles originales et jolies.
2,Very unique & can be word dressy or casual.
2,Very nice! Thank you
2,"The ear jackets arrived in good time, nicely packaged and very well made! I would recommend these to anyone :)"
2,"Super thoughtful packaging with personal touches, well made earrings, good communication after purchase."
2,Very Nice! My sister is happy
2,These earrings our very cute ! I get a lot  of complaints! Bought a pair for my daughter and her friend too .
2,Very cool :-):-) Goes with everything. Thank you.
2,They bend when you are wearing them. Then they just never look straight again.
2,Interesting and unique earrings - and thanks for the little extra gift
2,So pretty! I have thin wrists so I bought the 5.5 size and it fits me perfectly! It's not too tight or too loose. I love it so much :)
2,So cute and tiny! I bought the Rose Gold Finish and I love the color. My ears are pretty sensitive but these earrings don't seem to hurt very much. It does feel a bit irritated on one side but it's fine.
2,"She always goes above and beyond to give me such a special experience for my custom orders. I have to be honest and say that this one is EXACTLY what I requested due to the gemstones I researched... and I like the ones she designed with her gemstone choices better! 😝 PHENOMENAL muse! Looking forward to the luck, wealth, and prosperity for 2021!"
2,I waited a week and a half so that I could give an honest review of the moon earrings. My ears are extremely allergic and this is the first time in almost 5 years that I was able to use a pair of earrings for more than an hour! I haven’t taken them off since I got them on the mail. They’re super cute and minimalistic and i’m definitely getting another pair from apartment020!
2,"These are the cutest earrings.  My daughter and I took a bee keeping course together and she couldn't love these earrings more!  They came wrapped in Christmas paper because they were a Christmas gift.  Beyond necessary, but very appreciated!"
2,The owner nailed it on my custom bracelet! It is so beautiful and well made. Quality is superb. Great communication about the design I had in mind for my custom order and any suggestions made by the owner were discussed prior to shipment of my purchase. Fast shipping as well. I'm so happy with my bracelet! Do not hesitate to ask about custom orders. You will not be disappointed.
2,"These earrings are just as described; cute, dainty and well made. I wear the same earrings every day, so quality matters, and I haven’t stopped wearing these since I got them 2 months ago. Shipped super fast and came with a hand written note. 10 out of 10, would recommend 😊"
2,"Absolutely love these!! Perfect size, great quality, the post wasn't too long or too short. My normally sensitive ears did not feel a thing when I put these on. Highly recommend!"
2,"After having a stillbirth in April, I wanted something to help remind me that a positive pregnancy is possible. This is a BEAUTIFUL bracelet and it is so well made. It makes me smile just looking at it."
2,Fits amazing! I absolutely love love love this bracelet. It’s beautiful and came in beautiful packaging. I also have noticed positive changes in my life since I received it. 10/10 would absolutely recommend
2,These earrings are beautiful ♥️. Perfect delicate earrings for every day reminds me of Peter Pan which I also love “ second star to the right” that was one of the things that drew me to this set. I love the fact they are made in Toronto it’s nice to support someone local .. shopping small you are supporting someone’s dream
2,"These earrings are so subtle and lovely. Great quality, nice packaging, and great customer service from the seller."
2,"Absolutely stunning! These are so cute and the perfect size. They are super sparkly and could pass as real diamonds. Plus, the packaging was very cute. Def my new fav earrings"
2,Well made and just so cute! I have been eyeing these for awhile and finally decided to treat myself. Love them. So grateful.
2,Very tiny but super cute.  Great to just leave in all the time.  Wish I could get a little larger pair too!!
2,"I love this! They’re super dainty and adorable. The white gold is so easy on my ears, and I love this!"
2,"I got these as a gift for someone, so can't speak to using them personally.  But the shipping was quite fast (considering), and they look great.  They are smaller than expected (less than 1cm) but I probably just didn't read the measurements.  Overall I'm quite happy."
2,"I love these earrings! Super cute, and very high quality. They are exactly as pictured, and shipped very quickly. Highly recommended 😊"
2,"Really love these squirrels, they're really adorable and so cute. Also dispatched right away and arrived in a cute little box. Would be really nice as a gift"
2,"The earrings are perfect!  They arrived quickly and because I had marked them as a gift, they were even wrapped in Christmas paper with a ribbon.  All I did was add a tag and my niece loved them!"
2,The bracelet exceeded my expectations. Will definitely buy from here again :)
2,"they are AMAZING! feel super high quality, and come with two earring backs. i ordered a couple things from the shop, with this being for myself and the others gifts, so i recommend that if you’re buying multiple earrings for different people to try asking for different paper for each pair (what i wish i did!)"
2,I love it!  It has a very calming effect and it's beautiful.  The quality is great and the service exceptional. I have ordered a number of bracelets from apartment020 and love everyone of them.
2,They’re so cute! Just like the picture :)
2,Ordered a custom bracket and was very happy with the final product. The seller was a pleasure to work with. I would definitely order from this shop again.
2,"Perfectly crafted sparkling star earrings for my teen niece. She loved them, and I love how beautifully it was wrapped and boxed! Thank you! 💜"
2,"I got these as a gift for someone, so can't speak to using them personally.  But the shipping was quite fast (considering), and they look great.  They are smaller than expected (less than 1cm) but I probably just didn't read the measurements.  Overall I'm quite happy."
2,I believe the service was truly exceptional....communication was a awesome and I do appreciate the effort made with my custom request....the design exceeded my expectations and I plan to do more business in the very near future...I highly recommend this customer...
2,"It is gorgeous and looks nice on my arm. I like jewelry I can wear with everything....casual, formal and informal. This bracelet works. The energy is amazing. I cleansed and energized it in my selenite bowl. Thank you."
2,"I am in love with this bracelet, i wear it everyday! The owner is really nice too. I will definitely buy again from this store :)"
2,"A solid, very clean cut. Perfect size for me, I love these crescent studs!"
2,"Love love love!! These moon earrings are now a staple in my wardrobe, they are beautiful. Definitely recommend to anyone looking to purchase them!"
2,"I love these little earrings! Christmas gift for myself. Great customer service too, so that's a giant plus!"
2,I mistakenly thought the bracelets had not arrived. The small package had fallen down between other larger packages and I finally found it. All my fault. I give the seller lots of credit because she went to the ends of the earth to help me locate package (feel so bad!) and she even offered me a refund. The bracelets are very good quality! The jade color is gorgeous! I thought the rose quartz would be more pink-more like it looked in the photos. I hope the seller can forgive me for my mistake! Thank you Apt020 for the pretty bracelets!!
2,love it! shipping took longer than expected but it's understandable due to the current circumstances
2,Beautiful!! I loved every detail of it.
2,"They're super cute, exactly as pictured. They just ended up getting in way too late with the only shipping option due to USPS this year."
2,Love these! They are perfect 🤩
2,Beautiful! Arrived quickly and look exactly as pictured. I love them!
2,I have ordered a number of bracelets from apartment020 and the quality is great!  This one is another beautiful bracelet.  My sister will love it. It's met for her. The service is amazing!
2,"Amazing! Real stones. Bff loves the gift! Great fit, early delivery!"
2,So cute! Packaging was perfect
2,These earrings are SO gorgeous! I got so many compliments for them.
2,ADORABLE earrings!!! and great packaging:)
2,Fast shipping and gorgeous earings
2,"So excited about these beads!! So many beautiful ones, such great value. Can't wait to make something!"
2,Absolutely beautiful stones.
2,"Very happy with my purchase. These earrings are the perfect, sweet little studs!"
2,Absolutely stunning bracelet! I am so happy and excited it came so quickly💕
2,I got 2 of these. One for myself and one for my mom. Impeccable quality! Beautiful green color and fit is just perfect. I ordered a 3rd one for my sister yesterday. She must have it too.
2,SO GORGEOUS! These have become my every day wearers and I get compliments wherever I go!!
2,Very nice beautiful I love the beads. Thanks to the seller.
2,"GET IT. It looks really good, everybody thinks it is the mejuri one. Only reason it is not 5 stars is because the clasp is not gold plated i guess and has turned brown, I also saw little glimmers of the corroding color on the chains, but mostly it looks like it did when I first got it. (I do wear my necklaces in the shower and swimming though and this one has held up well for the month-ish I've had it.)"
2,Je les adore :) Elles sont confortables et super service :)
2,"Beautiful bracelets and the very kind, helpful seller! I was very happy that it came in super pretty gift wrapping too :)"
2,The bracelets are so beautiful and well made.  Shipping was fast~! The jewelry boxes were gift wrapped so pretty.  Thank you~! :)
2,Happy with my order! It’s such a beautiful bracelet.
2,These will be the perfect gift! They are so dainty and perfect.
2,Very pretty necklaces. Thank you for the super fast shipping!
2,Christmas gift for DIL she loved them!
2,So pretty!! My new favorite everyday earrings
2,"Perfect size, exactly what I was looking for. Thanks!"
2,"Beautiful quality, fits perfectly! I love the colors and weight, thankyou so much!"
2,Beautiful!! Love this bracelet so much!
2,so cute and dainty! Would get again.
2,Very beautiful bracelet. Love the ombre moonstone and the gold filled accents. Highly recommend this seller!
2,Would definitely order again. Awesome quality.
2,Would definitely order again. Awesome quality.
2,Delivery was timely and the items were delivered in perfect condition.
2,Very pretty and well made
2,Bought these for my boyfriend for Christmas and he loved them! They ended up being smaller than anticipated but it actually worked out better for him :)
2,I got 2 of these. The quality is impeccable! The color is beautiful! A must have!  I got a 3rd one yesterday for my sister😊
2,They're really nice and very beautiful!
2,Beautiful and sturdy bracelet. My heart loves it <3
2,"just beautiful, delicate earrings!  perfect for my 14 year old daughter who just got her ears pierced."
2,Beautiful quality as always. I have bought quite a few items from this shop for myself and for upcoming Christmas gifts. Items arrived in perfect condition and radiating positive energy. Would definitely recommend and appreciate the extra gift from seller! Thank you.
2,Right one is the purchased pink opal bracelet.
2,"The bracelet is beautiful, just what my daughter wanted. I was glad to give her such a special gift. I will definitely be back!"
2,Very happy with this item and also with the customer service!
2,A beautiful set of three bracelets with soft colors.I love them! Thank you.
2,These earrings are so pretty and of good quality!!
2,"Beautiful bracelet, well packaged, high quality gemstones, great customer service!"
2,"Beautiful bracelet, well packaged, high quality gemstones, great customer service!"
2,I'm so happy with my bracelet - it's beautiful and clearly made with love. It was packaged carefully and in a gift box so arrived in Australia swiftly and intact. Thank you!
2,Sweet dainty minimal... just what I ordered
2,Fast shipping and I love my jade bracelet thank you!
2,Wonderful !
2,Beautiful!  I love it!
2,"Beautifully made. I had made a mistake with shipping address, wrote to explain, the owner replied and the bracelet arrived on time at the correct address."
2,The stars were much smaller than I expected.
2,"Beautiful jewelry, packaging, shipping, and customer service!"
2,Quite lovely and soft against the skin. Shipped quickly and arrived quickly! Nice packaging too. Very pleased!
2,Beautiful! ❤️❤️❤️ Will purchase again!
2,"We had an issue with our order not being delivered and we got a very prompt response and a new one was sent out immediately! 

Great customer service !"
2,Very pretty!  Thanks so much!
2,Exactly what I expected. Very cute! It was a gift for my mom and she loved it!
2,"It's small, thin, and dainty! I'm looking forward to wearing this :)"
2,Super cute! Great for my gift basket!
2,"It's hard to find black jewelry so I was pleased to see this. 
Should go nicely with lots of winter outfits."
2,Great quality!
2,"Thank you. My tourmaline bracelet arrived quickly, wrapped with a note, just in time for Christmas! I definitely recommend buying from this seller."
2,Beautiful as always!
2,"true to picture, and they hold well I know some of my earrings fall out of my ears constantly but these feel really secure"
2,Beautiful bracelet and great pricing! :) I'm very happy with my purchase.
2,adorable earrings! came quick too!
2,"Beautiful little hearts, just as described!"
2,Exactly what I needed for my empath daughter.
2,Just beautiful!-- and arrived in a very timely manner with a card outlining the stones' properties.  :o)
2,It was a gift for my girl and she loves it!
2,"Very nice! Fits well, looks great!"
2,"It came early, and was just as expected! Thank you so much!"
2,Beautiful bracelet for my daughter. Quick shipping. Gift wrapped and all. Thank you!
2,"I struggled with staring this review.  The earrings are so pretty and have not bothered my incredibly sensitive ears, however; when taking them off the earring bent.  So now I have a bent earring.  Overall as described, but unclear why they bent...."
2,So beautiful! I gave this as a gift and she loved it.
2,For the price it was ok but the color looks a bit off.
2,Gift wrapped and ready for Christmas. Great shop!
2,Beautifully crafted and authentic. Arrived just in time. Lovely presentation. I intend to purchase more items in the future.
2,Got it for my wife and daughters. They loved it! Thank you.
2,Shipment was fast nice bracelet.
2,I never received the item.
2,VERY pretty! She will love it.
2,Shipped quickly and look beautiful.  Thank you!
2,An everyday wear. They are absolutely lovely. Package arrived on time.
2,"Very cute, thank you!!"
2,Loved my bracelets! Even came with a little gift I can use as a stocking stuffer. Thanks!
2,was a gift that was really enjoyed
2,Arrived on time. Beautifully made!
2,Very pretty! It arrived quickly from Canada to North Carolina. Thank you!
2,bought it for my sister!
2,Arrived safely and product is as described.  Am happy with purchase.
2,Arrived safely and product is as described.  Am happy with purchase.
2,"As described, did not burn ears"
2,"I still haven’t received my item, however I was refunded in full."
2,I never received this order of 4 bracelets. Very unhappy.
2,"I think this would be too small for a man, so I gave it to my niece."
2,"The earrings are BEAUTIFUL and so dainty, I love them! I am overall very pleased with the shop and the item, I will be coming for sure for more in the near future!!"
2,"Exactly as pictured, fantastic quality, well worth the purchase. There was initially a mix up with my order and when I contacted the seller to inquire she had the issue corrected within minutes, no questions asked and without any cost to me. Overall a very pleasant experience. The customer service alone will make this shop a go to for me in the future. Thanks again! I look forward to browsing future collections."
2,These are beautiful! It is comfortable to wear and I receive such great compliment about them! Will definitely buy from this seller again! Shipping was right on time. Thank you so much!
2,this is so cute - wow
2,super adorable- AND great customer service!
2,"They're so cute I LOVE THEM. Look exactly like the pictures, the climber piece has an adjustable hook for your ear so you can bend it to tighten the hold. 💖"
2,These earrings are STUNNING! And came in the cutest packaging. I would definitely purchase from this seller again.
2,"Very much my style, I loved them!!"
2,"Earrings are great, love the look of  them!"
2,Great wrapping and items! The ring is beautiful!
2,Very cute earrings and it was fast shipping. Love it
2,Gorgeous!! Fit well and are the perfect ear accessory!
2,"They are super pretty but very, very fragile. The ear cuff on the climber broke off as I was taking my earring off. I owned them for less than a month when it happened. I'm disappointed."
2,Very nice but a little smaller than I would have like.
2,"Absolutely gorgeous! I'm in love with these earrings, thank you for the extra gift!"
2,"I literally love these. Kathy custom made mine as my ear is rather small, and it's perfect. xx"
2,"Love these earings! So unique and so we'll made. I would give them 10 starts if I could!

Kathy was so nice to work with and so considerate with communication and sending updates. Took about 5 weeks to receive but well worth the wait!!"
2,"I am absolutely in LOVE with these earrings. They are so stunning and the picture doesn’t even do it justice. And Kathy is even better! I ordered these earrings very close to Christmas and she was SO kind and accommodating. I received the earrings so quickly and they were packaged so nicely and with a sweet note! It’s also really nice that these fit really nicely around my second earring, since the piercing is still rather new and I like to keep the earrings in. So beautiful! They’re my new favorites!"
2,"Beautiful earrings, very comfortable.  Shipping was so incredibly fast, I got it far before I expected to.  The only thing I would caution other buyers about is that if you have smaller ears/earlobes the earrings might not stay upright very well.  I didn't think about it before ordering, but I do have smaller lobes and the fit isn't snug enough to stay exactly where I'd like.  That's my fault for not considering it though, and I do still love the earrings even though they end up a bit diagonal on me.  Thank you very very much!!!"
2,"Absolutely fabulous!
I was expecting them to have more of a hand-made look, but no, they are polished, and even, and just beautiful! Will wear them on my wedding! 10/10 would recommend."
2,"The earrings are absolutely beautiful! It took me a while to receive them, because I live on a different continent, but they worth the wait, and Kathy was exceptionally supportive."
2,I am absolutely in love with the Venus earrings! They’re so unique and look so cute on. Would highly recommend!
2,"Kathy is so talented! I adore these earrings and wear then daily. They are so unique and I get so many compliments!!

Completely worth the wait! Kathy was quick to respond with updates as she handmade each piece. Took about 4 weeks to receive."
2,My new faves!!! Love them so much! Thank you so much
2,"As always - I’m in love <3 I absolutely love these earrings! So different, so original... ahh :))"
2,"I literally love this earring. Kathy custom made mine as my ear is rather small, and it's perfect. xx"
2,💖 love it
2,"Vraiment super beau et une belle finition, je les porte tous les jours, elle ne sont pas trop lourde et vraiment confortable ! 

Un gros merci à l'artiste ! 😁♥️"
2,The earrings are fantastic! Definitely what i expected! Love this store!
2,I love this item! High quality and simple yet unique. It’s become my go-to earring. Seller was also very lovey and communicative throughout. Thank you!
2,"Beautiful, unique design and high quality construction."
2,"This is honestly the most unique piece of jewelry I own!! You will not regret buying from Kathy. Messages are answered quickly, orders arrive on time, and purchases are packaged beautifully!!! Don’t hesitate to buy from this seller❤️❤️❤️"
