overall,reviews
5,The colour for the rose gold is really different to the picture and they also definitely look longer on the ear than in the photo. Seller said it was okay to return but then had a go at me for saying the two products looks different and didn’t feel it was fair I cop the shipping costs as it cost me as much as the earrings. Probably wouldn’t shop here again.
5,Some of the wire is a tiny bit rusty but overall very happy with my purchase!
5,"Extremely happy with the colour, quality and fit! Has a really nice weight to it and is obviously not made with a cheap, crappy material. Originally got the yellow gold necklace but it wasn't my colour, so I returned it and got the rose gold and it was perfect. Will definitely purchase another item in the future!"
5,"I love it , it’s so pretty and fits perfectly. I have a slim neck and I like that it rests mid way."
5,Super fast shipping. Love these earrings
5,Love it!  Great item. Speedy delivery perfect!
5,They arrived in a timely fashion in a nice little bag.  The earrings themselves are smaller than pictured - I wanted them to go higher up the ear but am pleased that they are pretty enough to wear.
5,I’m very very pleased with my purchase & very happy with the customer service Thank you 😊 👏🏻👏🏻👏🏻
5,"As far as gold collars go, this is one of the best.  Very well made, sturdy and looks amazing with a charm on it."
5,Love these earrings; haven't stopped wearing them!
5,Absolutely beautiful and well made! Would definitely recommend!
5,Great color and good workmanship. They are different and fun.
5,Love this shop! My go to for chokers in various color finishes as well as  matte or glossy choices.  Great communication too!
5,"Sits beautifully on the neck.. very elegant and Albert, the owner of this store was polite and very easy to do business with.. business with ease is always a happy experience, recommend having a look..juluex"
5,Many thanks. Beautiful earrings .
5,"I love gold collar necklaces and this is exceptional, it’s perfect"
5,Quick delivery. Product as expected.
5,"The choker us exactly like I wanted, and fits perfect. It arrived in the time expected in excellent shape. The merchant, Albert, of Dazel Creations was very easy to work with. He responded quickly to my questions."
5,The earrings are just as pictured and very nice. They can be worn with so many things.
5,Quick delivery and item was as described.
5,"I really like it, very nice quality of work but it was too short for my neck. I have an average size neck, not at all fat but it didn't  go all the way around. When I contacted Albert, he would send an extender."
5,Elles sont magnifiques et s’adaptent à tous les styles. Mon petit astuce: j’entrecroise les extrémités en pressant un peu le haut de la boucle pour ne par risquer de la perdre. Je les adore 😍
5,Love the simplicity and material of this choker!
5,So beautiful ??
5,"Took a little longer then i expected but its the holiday season and was coming from another country. Not being able to track it was probably the only complaint I have.

It is perfectly described and beautiful, the girl who received it was ecstatic! Great job!"
5,A little  bit smaller than I expected but otherwise perfect.
5,"Item arrived the same day it was posted (though we're in the same city) and is exactly as described. Lovely earrings, will definitely be shopping with them again."
5,Fast turnaround and earrings were just as I expected.
5,The wire choker fits perfectly.
5,"Lots smaller than the picture made out. A little disappointed with the size, but shipped quickly and easy to deal with"
5,"I love it, as described on the photo.
Very happy"
5,This came as gold. Not rose gold
5,The gold flakes off after a white but still beautiful
5,Great quality and sturdy but looks lovely and elegant.  Very happy with the style!
5,It’s awesome! Thanks. Fast delivery too!
5,Great shop! Very accommodating.  Had a delivery issue and seller went above and beyond to resolve. :)
5,Great style! Great communication! Love this shop.
5,Thank you - super cute. Exactly as pictured.
5,Es perfecto. Queda bien con todo.
5,Super quick postage and looks just like what’s advertised. Thanks!
5,"excellent quality, craftsmanship, and looks"
5,Very pleased. Great price. Looks good.
5,Item took a very long time to arrive so not advisable if required for a specific time or present. Supplier was very helpful during the wait and did offer a refund. The item was originally for myself an adult size 12 with a slim neck but is very neat fitting and although I could wear it i am going to keep for a present for my granddaughter. The item itself is very pretty and well made
5,item as described and good quality
5,Great item! Exactly as described and seller shipped it super fast. Thank you! Very high quality item.
5,I am very happy with the purchase.
5,"So pretty! Just like the picture, Thank you."
5,Lovely rose gold choker necklace! Congratulations Albert for the beautiful work! :)
5,Well made! Very nice necklace.
5,Great communication from seller. Super quick shipping (thanks for getting it to me before Christmas) and beautiful necklace. Sits perfectly on the neck just like in the photo.
5,They had plastic backs which showed as they were in my ear. I had expected metal backs as per the image
5,Choker is not too tight and sits perfectly at the base of my neck.
5,Very quick postage.  They will be a Christmas gift for my mother.
5,Excellent customer service. Thank you
5,"Perfect, thanks, it was delivered in quite a short time (I live in France)"
5,"Lovely earrings, nice and sturdy, rapid dispatch .
Thank you"
5,"Thanks for the Beautiful, great qualityh necklace!"
5,"Beautiful cuff, shipped very quickly."
5,"Very nice, delicate, good quality"
5,"Fast shipping, gorgeous design, I wear these every day"
5,"Came on time, really cute ear climbers :)"
5,My adult daughter loves these! They look like they are well made.
5,Super cute and high quality!! I have gotten many compliments on them :) Great for people who have only pierced their ears once and don’t have 2nd holes
5,Love these sweet leaf climbers. They are beautiful and well made. I will definitely order again. Thank you!
5,lovely jewelry!
5,These earrings are beautiful and they arrived within a few days of my order.
5,Love the earrings!  Very comfortable and they stay put even when taking a mask on and off.
5,These are precious. I’ve never owned a pair of climbers and I love them.
5,"These are so beautiful! They arrived quickly and are great quality. I was worried that they would be flimsy, but they are not at all."
5,Love these! The perfect size for my ears and they shipped super quick!
5,Great product. And great customer service! Seller responded quickly. I got my items quicker than I expected; another plus! Will definitely be purchasing from her again!
5,"Kind of bummed, I ordered these and they are absolutely beautiful! Unfortunately, I had them only two days before one broke. So sad."
5,I absolutely love my ear crawlers they are adorable and stay put unlike most where you have to keep adjusting and tightening! I’ve received so many compliments! I can’t wait to get more! I love these earrings so much I would love to help the owner advertise! 😘
5,"Small, dainty, cute!  Quick shipping.  Great service!"
5,A little smaller than I expected but pretty.
5,Absolutely gorgeous earrings - they look high quality and I’m eager to give them as a gift! (Might buy some for myself later too) Shipping was super speedy as well
5,Very beautiful. Would order from this shop again. Shipped quickly.
5,So happy!! Exactly as described and arrived quickly!!
5,First time buying ear climbers and they are adorable.
5,Beautiful! Wearing these with the small studs and I LOVE IT !! Quick shipping and beautiful quality:)
5,Arrived quickly and packaged well. Bought them for a Christmas present and my daughter loves them!
5,Very pretty and fast shipping!
5,"Bought these for my daughters Christmas gift so she hasn’t worn them yet, but they’re very pretty and I know she’s going to love them."
5,Arrived quickly as described.
5,Beautiful!!
5,Lovely delicate climbers. Good choice
5,I love them. They are delicate and are easily bendable but sturdy at the same time. Very simple and cute.
5,Absolutely love these!  So beautiful! Thank you !!
5,Beautiful earrings! Exactly what I was looking for and the perfect size.
5,Great quality and beautiful on!
5,"I Love Them, 
Thank You!!"
5,Perfect! Super cute and well made. Thank you!
5,"Very pretty & just as pictured!  I love that you can't even feel them, they are so comfortable!  Got lots of compliments.  Fast shipping too - thanks!!"
5,Cute earrings. Thank you lots!
5,"Perfect!! Absolutely love these, they’re exactly as described and everything I wanted!"
5,"Love these earrings, so cute!"
5,Very dainty and beautiful earrings!
5,"I LOVE these earrings! They shipped and delivered super quick and when I received them I was so happy. The price was great as was the quality. These ear climbers are so cute!! In addition, the shop owner is great. I had a couple questions and they were answered thoroughly and very quickly. I love shopping on etsy and supporting small businesses but I have never had a shop owner that was so quick to answer messages and ship products! Would highly recommend this shop!"
5,"Loved that they fit on my second hole, super pretty for graduation."
5,Earrings were so lovely.  Wore them to a wedding which upped the style of my dress.  Thank you!
5,Such a great piece of jewellery. great service too! Really really happy with the earrings and the brand! Thank you a lot
5,When I saw these I just had to buy them! They are so different and look so great on. They are not heavy either. Love them.
5,"Scheint nicht aus einem Metallguss zu sein. An dem Teil, das im Ohr sitzt platzt eine Beschichtung ab.

Ich habe echten unbeschichteten Silberschmuck und der ist biegsam. 

Das hätte ich bei diesem Produkt auch vorausgesetzt, da ja jede Ohr-Form anders ist und eine Anpassung benötigt.

Hübsch sind die Ohrringe, aber es hilft nichts, wenn man sie nicht an das Ohr anpassen kann, ohne dass sie brechen.

Man zahlt wohl für das Design nicht das Material."
5,"Superbes boucles offertes à ma sœur pour son Noël, elle est ravie. 😉"
5,Climber is shorter in length than on photo. So it sits rather awkwardly on the lobe.
5,Really like these!  Will wear a lot!  Thanks
5,What a beautiful set of earrings. I’m looking forward to jazzing up my next outfit out with them!
5,This is very nice. Thanks.
5,Amazing amazing amazing... would have paid 3 times this amount on a site like West Elm but the quality in this cactus series is even better! Love them all.
5,Amazing amazing amazing... would have paid 3 times this amount on a site like West Elm but the quality in this cactus series is even better! Love them all.
5,Amazing amazing amazing... would have paid 3 times this amount on a site like West Elm but the quality in this cactus series is even better! Love them all.
5,Ah-mazing! I want a whole tree full.  Love love love
5,"Beautiful, exactly as described, and arrived on time. My mother and have always loved Asian culture but honestly, whose doesn’t lol? Architecture, furniture, martial arts, cuisine, clothes, philosophy, you name it. I figured this lamp would be a great gift and I was right! She loved it!"
5,So cute! This cactus brightens my desk at work and makes me happy every day!
5,"I have one of these that I bought from Target and I love it.  This was a comparable item, but a few dollars more than the one from Target (although I can’t find them at Target anymore).  This item was used as part of a trophy, in which an adorable mini “ugly Christmas sweater” was placed over it and given as an award.  The winner of the trophy proudly displays the trophy."
5,Absolutely adorable! I love it!
5,Gorgeous craftsmanship!
5,Super cute and just as pictured.  Seller was responsive and easy to work with!
5,Super cute and just as pictured.  Seller was responsive and easy to work with!
5,Super cute and just as pictured.  Seller was responsive and easy to work with!
5,Absolutely adorable.  Perfect size and great quality
5,"Once again, stellar craftsmanship! 🥰"
5,Fast shipping and a cool product! Looks even better than the pictures.
5,beautifully made - thank you!
5,beautiful craftsmanship! ordered for my mother in law and she loved it
5,Thank you so much! Just beautiful! 😍
5,This shop never disappoints! Just LOVELY! 💝
5,I bought the rose cold constellation earrings as a birthday gift for my sister and she absolutely loved them. Sophia also answered all of my questions promptly and was very accommodating. I also received the earring sooner than expected. Very happy with my purchase :)
5,"-PERFECT GIFT IN STERLING SILVER- 
-FOR COOL-CHIC LOOK-

As This Item Was Given As A Gift And Arrived In Gift Box Presentation, Have Not Seen It As Of Yet.  However, The Recipient Seemed To Really Like The Constellation Ear Crawler Set In Sterling Silver.
Additionally, For Those Desiring Great Customer Service, Zoey Is It.
 -Stellar Customer Service- :  
-Quick To Respond To Questions- ; + 
-Quick To Ship- ; + -Quick To Receive- ; + -Great Gift- + -Boxed Gift Presentation- ; + 
-Overall A Very Cool, Good-Quality Piece- .

HIGHLY RECOMMEND THIS SELLER!!!!! 

For A Fun Cool-Chic Look, Highly Recommend This Specific CONSTELLATION Stars Ear Climber/Ear Crawler Piece, For Sterling Silver Jewelry Pieces!!!!!"
5,Beautiful earrings!! They look even more amazing in person! Very fast shipping! Will certainly be ordering more :)
5,Love these earrings! They are the perfect size. Also shipping  was incredibly quick!
5,"Love this ear crawler and all my pieces from Vintage Acorn. Well crafted, friendly seller and was able to pick up at my convenience!"
5,Very cute! Has a little bend though so I would be careful if you're very active.
5,"Love love these! Casual enough for everyday wear, but flattering like dressy earrings. Really flattering."
5,My wife loved these. They’re easier to put on than other ear climbers and look great.
5,Super cute climbers and the packaging was lovely.
5,"My earring arrived very quickly, love the earring and the cute little box it came in.
Thank you"
5,"J'aime le look de la boucle d'oreille, toutefois elle bouge un peu puisque la tige derrière n'est pas comme celle des grimpeurs d'oreille traditionnels."
5,Very cute exactly what I was expecting.
5,I’m excited to gift this! Thank you!
5,Pretty. But they are a little flimsy and sometimes hard to put in and get out. They are very pretty though.
5,Beautiful piece and fast shipping! Thank you!
5,"The climbers look great, and seem high quality.

There were some issues with shipping, causing them to take more than 25 days to arrive from the time when I was notified that they were shipped. Not entirely the seller's fault, as the Canadian post went on strike for a while and probably delayed the shipping, but unfortunately they did not arrive in time for Christmas, as they were intended to be a gift."
5,"Great earring, does not always stay up (e.g. if caught in hair of scarf)."
5,I cant stop ordering these! I am blessed to have expensive jewelry and I get more compliments when I wear this bracelet. They are so unique and people just love them!
5,"Love my necklace. It's perfect. Definitely get one. Everywhere I go, people ask about it. 🥰"
5,I am absolutely thrilled with this! It’s classy. Simple. Elegant. The chain is almost invisible which spotlights the Swarovski crystal “diamond”. The stone sparkles! And when on my neck it lays well and does not twist or tangle. I am impressed and I do not impress easily. I will be ordering other pieces.
5,I cant stop ordering these! I am blessed to have expensive jewelry and I get more compliments when I wear these necklaces. They are so unique and people just love them!
5,"Tres joli bijou! Je l ai offer a ma soeur pour son mariage. Je suis entierement satisfaite. De plus envoi tres rapide.. travail de grande qualité.. merci bcp..
Delphine"
5,"Commande passée lundi 21/10, collier reçu le 23/10 (livraison rapide). 

Trop contente ! il correspond totalement à mes attentes, j'ai commandé le 8mm avec finition argenté, je ne quitte plus le collier, je dors avec et fait du sport avec, je le garde même sous la douche et il tient très bien.

Je vais le commander de nouveau en 6mm, pour le prix autant se faire plaisir.
Merci Creamelanie ^^"
5,I loved it! I get so many compliments 🥰
5,"Très jolie collier ,fait beaucoup d'effet .
Mélanie est super , très réactive , ça fait plaisir ! Merci encore une fois pour votre gentillesse. Je recommande cet article"
5,Je suis très satisfait de cet achat qui est un cadeau pour ma sœur. Le bijou m’a été envoyé très rapidement (malgré les conditions actuelles) et les contacts ont été très agréables. La qualité est superbe et conforme aux attentes.  C’est fin et c’est très joli. Je recommande !
5,"Livraison très rapide, beau produit pour un prix raisonnable. La vendeuse est à l'écoute et prend le temps de répondre, tout en personnalisant les commandes rapidement. Nous sommes très satisfaites de nos achats. Merci."
5,It is absolutely beautiful!! Exactly what I was hoping for-thank you so much!!
5,"Je recommande vivement, collier très joli avec ce cristal de Swarovski et de plus, je remercie Mélanie qui a été très compréhensible suite à mon erreur."
5,Très satisfaite ! Du plus bel effet. Vendeuse très à l'écoute et de très bon conseil. Pris en 8mm finition argent
5,"Le collier est encore plus beau en vrai ! Livraison rapide et créatrice à l'écoute, je recommande sans hésiter."
5,"Très joli collier féminin ! Mélanie répond hyper vite aux questions, envoi rapidement les achats qui sont bien joliment présentés. Bref parfait ! Merci pour tout."
5,"Magnifique collier, discret et élégant. Bijou de bonne qualité, parfait pour les beaux jours qui arrivent. Envoi rapide et soigné.
Je recommande ♡
Merci beaucoup!"
5,"J'ai commandé ce collier le 10/11, il est en transit depuis le 14/11 et sa position n'a pas bougé!  Nous sommes le 20/11 et je ne l'ai toujours pas reçu! Inadmissible !!"
5,"Super beau, très rapide je suis super contente, je recommande fortement 😊"
5,"Ce collier est conforme à la photo. La pierre est brillante, c'est un joli bleu pour l'été. La longueur de 42 cm donne comme sur la photo. Je mets 4 étoiles car j'aurais aimé que le fil nylon soit plus épais. 
Merci pour vos créations."
5,Love it
5,"Merci Mélanie
Bien reçu, bien emballé, et tout mignon........"
5,"This is the second one I purchased.  The first was too small - my fault for not measuring right.  Gave it to my daughter and after seeing it on her I had to order one for me.  Its beautiful, simple, and sparkly.  I love it!"
5,I received my pendent today and it’s stunning!  It’s even more beautiful then I expected!  Seller let me know it might take longer to ship because of fewer planes I think she said. But Shipping was very fast considering it came from France to Florida.
5,"Très joli petit bijoux. Envoi très rapide dans un emballage soigné. Tout a été parfait. Je recommande vivement cette créatrice, bravo!"
5,"Le pendentif est très bien. C est l emballage qui laisse à désirer. Je veux l offrir à une relation de travail et il n y a même pas de carte de la créatrice. 
De plus on nous indique qu on peut joindre un mot avec le produit. Quelle ne fut pas ma déception de voir ce mot écrit à la main, sur un papier simple, découpé  avec un ciseaux cranteur.. Ça je peux le faire...
 En résumé je suis très déçue par la mise en valeur du produit..surtout de ne Pas avoir de carte de la créatrice. Je ne trouve pas ça normal, quand on achète sur etsy, ça me semble évident ! 
Ceci dit le collier est très bien et conforme à ce qui présenté. La livraison rapide."
5,Vendeur très sérieux ! jolie emballage et colis suivi. C'est une obligation qui devrait être mise en place par tous les vendeurs sur ETSY.
5,"Réalisées à ma demande en zirconium pour être assorties au collier que j'avais déjà reçu, ces boucles d'oreilles sont parfaites. Elégantes et réalisées avec soin, et toujours aussi joliment emballées.
Créatrice de bijoux recommandée."
5,"Bijoux très joli ! 
La longueur correspond exactement à mes attentes, le cristal est vraiment magnifique, le fil très discret et l'attache nickel !
Je ne peux que recommander !
La créatrice et vendeuse est très attentionnée."
5,"Commande arrivée rapidement, emballage nickel et petit mot personnalisé qui fait toujours plaisir. Je recommande !
Merci d'etre pro. quelque soit le montant de la commande."
5,Ravie de mon achat! Je recommande
5,"Collier d'une grande finesse de réalisation. Très élégant pour un prix plus que doux. Envoi rapide, joliment emballé avec soin. Vendeuse charmante et réactive aux questions posées. J'ai dès réception du collier commandé des boucles d'oreilles tout aussi jolies ! Un grand merci."
5,"Livraison rapide suite à ma demande. Merci beaucoup, très joli collier, je suis ravie. Conforme à mes attentes."
5,"Magnifique, très beau bijou 

Ravis"
5,"il est très élégant, je ne suis pas déçue.
il est vraiment très beau, la libellule est jolie et fine bien travaillée.
je suis satisfaite, je n'ai rien à redire dessus.
merci.
j'ai acheté ce bracelet puisque les libellules ont une symbolique particulière pour moi, je suis contente d'avoir enfin pu trouver un bracelet en argent avec une libellule.
Merci à la créatrice Mélanie."
5,"j’avoue l'article a mis du temps a arriver !!! suite au fête, le collier et très jolie je suis entièrement satisfaite ( merci Mélanie ) très bien emballer avec un petit mot qui l’accompagné avec un petit Stickers plaisir  d'offrir. je suis ravie"
5,Il et comme sur la photo parfait tres jolie et simple merci beaucoup je vous recommanderais ... Et je recommanderais :)
5,Super! Et de bon conseil !  Merci! Je recommande vivement !
5,"Cet article m'est parvenu à temps et j'ai été enchantée de sa qualité, je continuerai à acheter à cette boutique."
5,"Schöne Kette, es war so, wie ich es mir vorgestellt hatte und schneller Versand."
5,Exactement ce que je cherchais et que je ne trouvais nulle part. Collier porté pour mon mariage je suis ravie merci
5,"Le collier est exactement comme mes attentes , et la communication parfaite , et le plus la livraison super rapide ! Vraiment satisfaite"
5,"Merci ,pour votre rapidité et votre serieux .Le fil est vraiment invisible parfait  .Je recommande vivement  Creameline  ."
5,Simple et à la fois chic !
5,Super contente. Conforme à ce que j’attendais.  En plus je l’ai reçu vraiment rapidement. Merci 😊
5,"Très bien fait et très joli!
Cela fait un beau poignet."
5,"Muy bonito, resistente y en llegó en muy pocos días. Un acierto!"
5,Ravie de ma commande. Envoi rapide et colis soigné. Merci beaucoup ! :)
5,"C'est ma 2ème commande.
(Collier, boucles et bracelet)
Tout était parfait et conforme, très satisfaite du rendu, de plus ma commande était ""urgente"" elle m'a été livrée très rapidement.
Les bijoux sont réalisés avec soin."
5,C’est parfait !! Je recommande !! Merci à la créatrice.
5,C’est parfait !! Je recommande !! Merci à la créatrice.
5,"j ai reçu  mon colis 

Merci très beau"
5,"Super rapport qualité/prix, vendeuse tres sympathique et réactive, je recommanderai les yeux fermé."
5,"Ich <3 diese Kette und trage sie nun jeden Tag. 
Der Versand ging super schnell und der Kontakt war sehr freundlich.
Vielen Dank."
5,Absolutely LOVE!  Thank you so much!
5,Vraiment une superbe pièce! Je suis contente de cet achat!
5,"Il n y a rien à dire, travail bien fait, créatrice sympa. 2 eme achats et c est parfait. Merci à vous d être soignée."
5,Bien reçu ! Très jolie Merci beaucoup 😊
5,"Très beau !
Je souhaite en recommander"
5,Conforme très sympa livraison rapide parfait je recommande
5,"Très  beau collier comme sur la photo
Ça faisait longtemps que j'en  cherché comme ça et celui ci a un très bon rapport qualité prix. 
De la livraison et rapide. 
Je vous le recommande"
5,Je suis entièrement satisfait de mon achat. La confection et la présentation est soigné. Merci.
5,"Super bracelet, vraiment très jolie, très fin et raffiné! Je recommande."
5,Arrivées très rapidement ! J'aime bien (juste un poil trop grandes pour mon lobe ;))
5,juste parfait très beau rendu
5,Bijou magnifique ! on verra si le fil tient le coup avec le temps mais pour l'instant il va très bien. Article envoyé très  rapidement
5,Sehr schöne Kette 😍
5,Super ma femme et ravie et arrivé à l'heure super
5,"Un peu gros á mon goût.
Ça manque de finesse"
5,Colier parfait. Reçu rapidement!
5,I love this shop.  These necklaces are so cute and get so many compliments. Reorder often as gifts!
5,I love this shop. These necklaces are so cute and get so many compliments. Reorder often as gifts!
5,Très beau à recommander
5,"Es del tamaño adecuado
Un regalo perfecto."
5,very nice and simple...I will buy again !!!!
5,Parfaite ! elles dégagent beaucoup d'élégance!
5,This was a reorder. These Bracelets are so cute.
5,I received my necklace and loved it! I was very satisfied with it. I left another comment stating I wasn’t happy with th company and I was wrong. It took the mail service a little longer than expected to get here but that had nothing to do with the company. If you order from this company you will be happy you did!
